{
  "artifact_type": "google_sheets",
  "created_at": "2026-06-08T06:17:06.972975+00:00",
  "fields": {},
  "formula": {},
  "intent_id": "table-build-intent-2026-06-08T06-17-06-972975-00-00-81b4ef5b",
  "intent_kind": "table_build_intent_v1",
  "llm_prompt": "원본 데이터 안에서 팀별 월별 매출 합계를 새 시트의 수식과 참조로 채워줘.",
  "output": {
    "creation_mode": "sheet",
    "preferred_title": "CHATGPT_WEB_SMOKE_TABLE"
  },
  "output_canvas": [
    [
      "",
      "2026-01",
      "2026-02"
    ],
    [
      "Team A",
      "",
      ""
    ],
    [
      "Team B",
      "",
      ""
    ]
  ],
  "review_state": {
    "next_action": "Generate a TableBuildPlan from this intent and ask the user to confirm the interpreted table shape.",
    "status": "submitted"
  },
  "schema_version": "1.0",
  "source": {
    "artifact_type": "google_sheets",
    "header_row": 1,
    "qualified_range": "'Raw'!A1:C4",
    "range_start_column": "A",
    "range_start_row": 1,
    "sheet_title": "Raw",
    "spreadsheet_id": "chatgpt-web-smoke-spreadsheet",
    "workbook_path": ""
  },
  "source_hints": {
    "selected_ranges": [
      "'Raw'!A1:C4"
    ]
  },
  "source_package": {
    "manifest_path": "/Users/kangmin/Documents/excel-workbook-editing/review-packages/spreadsheet-table-builder/chatgpt-web-smoke/2026-06-08/chatgpt-web-smoke-1a23e444/table-builder-ui/2026-06-08/table-builder-preview-chatgpt-web-smoke-spreadsheet-Raw/manifest.json",
    "source_path": "/Users/kangmin/Documents/excel-workbook-editing/review-packages/spreadsheet-table-builder/chatgpt-web-smoke/2026-06-08/chatgpt-web-smoke-1a23e444/table-builder-ui/2026-06-08/table-builder-preview-chatgpt-web-smoke-spreadsheet-Raw/builder-source.json"
  }
}
